Titre du poste,Entreprise,Ville,Secteur d'activité,Contrat proposé,Niveau d'étude,Expérience,Compétences techniques,Langues,Soft skills,Lien de l'offre,Expérience numérique
SOMADIR recrute: Plusieurs opportunités à Casablanca et El Jadida,SOMADIR,Casablanca,"Agroalimentaire, Procédés",Non spécifié,Bac+2,3 ans,Non spécifié,Non spécifié,Initiative,https://www.dreamjob.ma/emploi/somadir-recrute-plusieurs-opportunites-a-casablanca-et-el-jadida/,3.0
SONARGES recrute 27 postes à Tanger et Rabat: Postulez avant le 5 février 2025,SONARGES,Tanger,Construction,Non spécifié,Bac+2,7 ans,Non spécifié,Non spécifié,"Communication, Gestion de projet, Innovation, Organisation",https://www.dreamjob.ma/emploi-public/sonarges-recrute-27-postes-a-tanger-et-rabat-postulez-avant-le-5-fevrier-2025/,7.0
Climholia SAS Recrute: Postulez en tant qu’Auditeur Énergétique,Climholia SAS,Marrakech,Énergie,Non spécifié,Non spécifié,2 à 5 ans,Autocad,Non spécifié,Communication,https://www.dreamjob.ma/emploi/climholia-sas-recrute-postulez-en-tant-quauditeur-energetique/,3.5
"LAMALIF Group recrute 3 profils à Marrakech, Rabat et Fès",LAMALIF Group,Marrakech,"Automobile, Logistique, Énergie",CDI,Bac+2,3 ans,Non spécifié,Non spécifié,"Innovation, Organisation, Rigueur",https://www.dreamjob.ma/emploi/lamalif-group-recrute-3-profils-a-marrakech-rabat-et-fes/,3.0
COVEC recrute Plusieurs Profils à Casablanca,COVEC,Casablanca,"Construction, Construction",CDI,Bac+3,5 à 10 ans,Non spécifié,"Français, Anglais, Arabe","Autonomie, Communication, Organisation, Relationnel, Rigueur, Travail en équipe",https://www.dreamjob.ma/emploi/covec-recrute-plusieurs-profils/,7.5
Offres d’emploi chez EM ÉNERGIE en électricité,Non spécifié,Kénitra,Énergie,CDI,Bac+3,1 à 3 ans,Non spécifié,Non spécifié,"Organisation, Rigueur, Travail en équipe",https://www.dreamjob.ma/emploi/offres-demploi-chez-em-energie-en-electricite/,2.0
Nouvelles offres d’emploi chez Sulzer à Casablanca,Non spécifié,Casablanca,Procédés,CDI,Bac+2,5 ans,Ms project,"Français, Anglais","Autonomie, Communication, Gestion de projet, Initiative, Leadership, Organisation, Polyvalence, Rigueur",https://www.dreamjob.ma/emploi/nouvelles-offres-demploi-chez-sulzer-a-casablanca/,5.0
Deux opportunités à saisir chez Ciments du Maroc,Non spécifié,Casablanca,"Construction, Procédés",CDI,Bac+5,5 ans,SAP,"Français, Anglais, Arabe","Autonomie, Autonomie, Communication, Leadership, Organisation",https://www.dreamjob.ma/emploi/deux-opportunites-a-saisir-chez-ciments-du-maroc/,5.0
SGTM ouvre 3 profils à Casablanca dès maintenant,SGTM,Casablanca,"Construction, Construction, Logistique",Non spécifié,Bac+2,3 à 5 ans,SAP,"Français, Anglais","Autonomie, Leadership, Organisation, Polyvalence, Rigueur",https://www.dreamjob.ma/emploi/sgtm-ouvre-3-profils-a-casablanca-des-maintenant/,4.0
"CEC recrute un Chef d’Équipe, un Commercial et une Assistante",CEC,Casablanca,Minier,CDI,Bac+2,Non spécifié,Automatisme,"Français, Anglais","Autonomie, Initiative, Organisation, Relationnel, Rigueur",https://www.dreamjob.ma/emploi/cec-recrute-un-chef-dequipe-un-commercial-et-une-assistante/,
"Extreme Agency recrute plusieurs postes de direction BTP, promotion immobilière et énergies renouvelables",Extreme Agency,Non spécifié,"Construction, Construction",Non spécifié,Bac+5,10 ans,Non spécifié,"Français, Anglais","Gestion de projet, Leadership, Organisation, Relationnel, Rigueur",https://www.dreamjob.ma/emploi/extreme-agency-recrute-plusieurs-postes-de-direction-btp-promotion-immobiliere-energies-renouvelables/,10.0
2 opportunités ouvertes chez TotalEnergies dès maintenant,Non spécifié,Non spécifié,"Chimie, Énergie",CDI,Bac+2,5 ans,Excel,"Français, Anglais, Arabe","Autonomie, Communication, Force de proposition, Innovation, Organisation, Relationnel, Rigueur, Réactivité",https://www.dreamjob.ma/emploi/2-opportunites-ouvertes-chez-totalenergies-des-maintenant/,5.0
6 postes ouverts chez EM ENERGIE à Casablanca et Jorf Lasfar,Non spécifié,Jorf lasfar,Logistique,CDI,Bac+2,5 ans,Non spécifié,Non spécifié,"Autonomie, Organisation, Organisation, Rigueur",https://www.dreamjob.ma/emploi/6-postes-ouverts-chez-em-energie-a-casablanca-et-jorf-lasfar/,5.0
Chargées ADV bilingues recherchées à Casablanca,Non spécifié,Casablanca,Non spécifié,Non spécifié,Bac+2,2 ans,"ERP, SAP","Français, Anglais","Organisation, Rigueur, Réactivité",https://www.dreamjob.ma/emploi/chargees-adv-bilingues-recherchees-a-casablanca/,2.0
Offres d’emploi back office achats chez Maroc Climate and Security,Non spécifié,Non spécifié,Logistique,CDI,Bac+3,Non spécifié,Excel,"Français, Anglais","Communication, Organisation, Rigueur",https://www.dreamjob.ma/emploi/offres-demploi-back-office-achats-chez-maroc-climate-and-security/,
Novec recrute 66 profils pour ses projets au Maroc,Novec,Dakhla,"Construction, Énergie",CDI,Bac+2,7 ans,"Autocad, Excel, Modélisation",Non spécifié,"Innovation, Organisation, Rigueur",https://www.dreamjob.ma/emploi/novec-recrute-66-profils-pour-ses-projets-au-maroc/,7.0
"LUSEO recrute plusieurs profils à Tanger, Fès et Dakhla",LUSEO,Tanger,Non spécifié,CDI,Bac+2,2 à 3 ans,Modélisation,Non spécifié,"Autonomie, Communication, Organisation, Rigueur, Travail en équipe",https://www.dreamjob.ma/emploi/luseo-recrute-plusieurs-profils-a-tanger-fes-et-dakhla/,2.5
Offres d’emploi BTP chez SGTM à saisir dès maintenant,Non spécifié,Casablanca,"Construction, Ferroviaire",CDI,Bac+2,8 à 10 ans,Non spécifié,Non spécifié,"Autonomie, Leadership, Organisation, Rigueur",https://www.dreamjob.ma/emploi/offres-demploi-btp-chez-sgtm-a-saisir-des-maintenant/,9.0
Stage PFE et emplois à saisir chez SGTM,Non spécifié,Bouskoura,"Construction, Ferroviaire, Logistique",CDI,Bac+2,8 à 10 ans,"Autocad, Excel, SAP",Non spécifié,"Communication, Leadership, Organisation, Proactivité, Relationnel, Rigueur",https://www.dreamjob.ma/emploi/stage-pfe-et-emplois-a-saisir-chez-sgtm/,9.0
Opportunités professionnelles à saisir chez NOMAC,Non spécifié,Ouarzazate,Énergie,Non spécifié,Non spécifié,2 à 10 ans,"ERP, GMAO, SAP","Français, Anglais","Leadership, Organisation, Résolution de problèmes, Travail en équipe",https://www.dreamjob.ma/emploi/opportunites-professionnelles-a-saisir-chez-nomac/,6.0
VINCI Energies Maroc recrute des stagiaires PFE Bac+5,VINCI Energies Maroc,Non spécifié,Énergie,Stage,Bac+5,Non spécifié,Automatisme,Non spécifié,"Autonomie, Initiative, Organisation, Relationnel, Rigueur, Travail en équipe",https://www.dreamjob.ma/stage/vinci-energies-maroc-recrute-des-stagiaires-pfe-bac5/,
Offres d’emploi chez Ventec à Casablanca en CDI,Non spécifié,Casablanca,Non spécifié,CDI,Bac+3,2 ans,Autocad,Non spécifié,"Autonomie, Organisation, Rigueur, Travail en équipe",https://www.dreamjob.ma/emploi/offres-demploi-chez-ventec-a-casablanca-en-cdi/,2.0
5 Opportunités CDI à saisir chez International Paper Maroc,Non spécifié,Casablanca,"Construction, Procédés",CDI,Bac+2,2 ans,"ERP, Excel",Anglais,Non spécifié,https://www.dreamjob.ma/emploi/5-opportunites-cdi-a-saisir-chez-international-paper-maroc/,2.0
Postes d’Agents Commerciaux Béton disponibles à Tanger et Casablanca,Non spécifié,Casablanca,"Construction, Construction",CDI,Bac+2,5 ans,Non spécifié,Non spécifié,"Innovation, Réactivité",https://www.dreamjob.ma/emploi/postes-dagents-commerciaux-beton-disponibles-a-tanger-et-casablanca/,5.0
Salam Gaz recrute à Rabat et Casablanca plusieurs profils IT et Comptables,Salam Gaz,Casablanca,"Logistique, Énergie",Non spécifié,Bac+2,5 ans,ERP,Non spécifié,"Innovation, Relationnel, Rigueur",https://www.dreamjob.ma/emploi/salam-gaz-recrute-a-rabat-et-casablanca-plusieurs-profils-it-et-comptables/,5.0
CAP Ingénierie recrute à Marrakech 2025 – 6 postes à saisir,CAP Ingénierie,Casablanca,Non spécifié,CDI,Non spécifié,5 ans,"Autocad, Modélisation",Non spécifié,"Autonomie, Créativité, Rigueur",https://www.dreamjob.ma/emploi/cap-ingenierie-recrute-a-marrakech-2025-6-postes-a-saisir/,5.0
Jet Contractors recrute à Marrakech: plusieurs postes ouverts,Jet Contractors,Marrakech,"Logistique, Énergie",Non spécifié,Bac+3,5 ans,Non spécifié,Non spécifié,"Autonomie, Flexibilité, Organisation",https://www.dreamjob.ma/emploi/jet-contractors-recrute-a-marrakech-plusieurs-postes-ouverts/,5.0
TotalEnergies recrute au Maroc: postes ouverts pour jeunes diplômés et experts,TotalEnergies,Non spécifié,"Logistique, Énergie",Non spécifié,Bac+4,2 ans,"Excel, SAP",Non spécifié,"Communication, Créativité, Innovation, Organisation, Rigueur",https://www.dreamjob.ma/emploi/totalenergies-recrute-au-maroc-postes-ouverts-pour-jeunes-diplomes-et-experts/,2.0
Emplois industriels à Tanger: Bel recrute des profils techniques qualifiés,Emplois industriels à Tanger: Bel,Tanger,Agroalimentaire,CDI,Bac+2,3 ans,"Autocad, CAO","Français, Anglais","Communication, Innovation, Rigueur",https://www.dreamjob.ma/emploi/emplois-industriels-a-tanger-bel-recrute-des-profils-techniques-qualifies/,3.0
AEOLON Maroc recrute à Nador: CDI pour plusieurs profils,AEOLON Maroc,Nador,Non spécifié,CDI,Bac+3,5 ans,Non spécifié,"Français, Anglais","Autonomie, Flexibilité, Rigueur, Travail en équipe",https://www.dreamjob.ma/emploi/aeolon-maroc-recrute-a-nador-cdi-pour-plusieurs-profils/,5.0
"VENTEC recrute: 3 postes à pourvoir dans le juridique, la logistique et le commerce",VENTEC,Non spécifié,Logistique,Non spécifié,Bac+2,5 ans,SAP,Non spécifié,"Autonomie, Innovation, Rigueur",https://www.dreamjob.ma/emploi/ventec-recrute-3-postes-a-pourvoir-dans-le-juridique-la-logistique-et-le-commerce/,5.0
Eaton recrute au Maroc: 7 nouveaux postes à Casablanca et Tanger,Eaton,Casablanca,"Logistique, Énergie",Non spécifié,Non spécifié,Non spécifié,Lean,Français,Innovation,https://www.dreamjob.ma/emploi/eaton-recrute-au-maroc-7-nouveaux-postes-a-casablanca-et-tanger/,
"Marjane Holding recrute des Facility Managers à Casablanca, Rabat et Nord",Marjane Holding,Casablanca,Non spécifié,Non spécifié,Bac+5,3 à 5 ans,Excel,Non spécifié,"Communication, Organisation",https://www.dreamjob.ma/emploi/marjane-holding-recrute-des-facility-managers-a-casablanca-rabat-et-nord/,4.0
Saint-Gobain Sekurit recrute des Techniciens EHS,Saint-Gobain Sekurit,Non spécifié,Construction,Non spécifié,Bac+2,2 ans,Non spécifié,"Français, Anglais",Innovation,https://www.dreamjob.ma/emploi/saint-gobain-sekurit-recrute-des-techniciens-ehs/,2.0
OMCo recrute: Analyste Financier et Responsable de Projets à Rabat,OMCo,Rabat,Énergie,Non spécifié,Non spécifié,3 ans,"Excel, Modélisation","Français, Anglais",Non spécifié,https://www.dreamjob.ma/emploi-public/omco-recrute-analyste-financier-et-responsable-de-projets-a-rabat/,3.0
Postes Ouverts chez Nomac: Postulez Dès Maintenant,Non spécifié,Ouarzazate,"Chimie, Énergie",Non spécifié,Bac+2,5 à 10 ans,Non spécifié,Arabe,"Communication, Organisation",https://www.dreamjob.ma/emploi/postes-ouverts-chez-nomac-postulez-des-maintenant/,7.5
Stages et Emplois Disponibles chez Bosch,Non spécifié,Casablanca,"Automobile, Aéronautique, Énergie",CDI,Bac+4,Non spécifié,"Lean, Six sigma","Français, Anglais, Arabe","Autonomie, Communication, Leadership, Rigueur, Travail en équipe",https://www.dreamjob.ma/emploi/stages-et-emplois-disponibles-chez-bosch/,
SEGULA Technologies Recrute: Découvrez les Postes Disponibles,SEGULA Technologies,Casablanca,"Automobile, Aéronautique, Ferroviaire, Naval, Énergie",Non spécifié,Non spécifié,3 ans,CAO,"Français, Anglais","Communication, Créativité, Gestion de projet, Innovation, Rigueur, Travail en équipe",https://www.dreamjob.ma/emploi/segula-technologies-recrute-decouvrez-les-postes-disponibles/,3.0
LUSEO Group Recrute des Techniciens en Électricité,LUSEO Group,Rabat,Construction,Non spécifié,Bac+2,Non spécifié,Modélisation,Français,Communication,https://www.dreamjob.ma/emploi/luseo-group-recrute-des-techniciens-en-electricite/,
(7) Opportunités d’Emploi Disponibles chez Coca-Cola,Non spécifié,Casablanca,Énergie,Non spécifié,Bac+2,3 ans,"Automatisme, GMAO, SAP",Non spécifié,Communication,https://www.dreamjob.ma/emploi/7-opportunites-demploi-disponibles-chez-coca-cola/,3.0
(3) Postes Ouverts chez Legrand,Non spécifié,Non spécifié,Énergie,Non spécifié,Bac+2,3 ans,Excel,Anglais,"Communication, Flexibilité, Proactivité",https://www.dreamjob.ma/emploi/3-postes-ouverts-chez-legrand/,3.0
(8) Profils Recherchés par G4S,Non spécifié,Casablanca,Non spécifié,Non spécifié,Bac+2,2 ans,Excel,"Français, Anglais","Autonomie, Autonomie, Communication, Organisation, Travail en équipe",https://www.dreamjob.ma/emploi/8-profils-recherches-par-g4s/,2.0
COFAT Embauche: Saisissez votre Chance !,Non spécifié,Kénitra,"Automobile, Logistique, Énergie",Stage,Bac+2,Non spécifié,Non spécifié,"Français, Anglais",Communication,https://www.dreamjob.ma/emploi/cofat-embauche-saisissez-votre-chance/,
Howmet Aerospace ouvre ses portes à de nouveaux talents,Howmet Aerospace,Casablanca,Non spécifié,Non spécifié,Bac+2,10 ans,5S,Non spécifié,"Autonomie, Communication, Organisation",https://www.dreamjob.ma/emploi/howmet-aerospace-ouvre-ses-portes-a-de-nouveaux-talents/,10.0
LUSEO Group ouvre de Nouvelles Opportunités de Carrière,LUSEO Group,Marrakech,Construction,Non spécifié,Non spécifié,5 ans,Non spécifié,Français,"Communication, Gestion de projet",https://www.dreamjob.ma/emploi/luseo-group-ouvre-de-nouvelles-opportunites-de-carriere/,5.0
Recrutement d’un Chargé QHSE sur Oulad Salah Bouskoura,Non spécifié,Bouskoura,Agroalimentaire,CDI,Bac+5,5 à 7 ans,Non spécifié,"Français, Anglais",Force de proposition,https://www.dreamjob.ma/emploi/recrutement-dun-charge-qhse-sur-oulad-salah-bouskoura/,6.0
Nextera ouvre ses Portes aux Talents de Demain: Candidatures de Stagiaires Ouvertes!,Nextera,Casablanca,Énergie,Stage,Bac+3,Non spécifié,Non spécifié,Anglais,Créativité,https://www.dreamjob.ma/stage/nextera-ouvre-ses-portes-aux-talents-de-demain-candidatures-de-stagiaires-ouvertes/,
FORVIA recrute Plusieurs Profils,FORVIA,Kénitra,"Automobile, Logistique",Stage,Non spécifié,2 ans,Non spécifié,Non spécifié,"Innovation, Leadership, Organisation, Proactivité",https://www.dreamjob.ma/emploi/forvia-recrute-plusieurs-profils/,2.0
Duroc recrute des Electromécaniciens,Duroc,Agadir,Agroalimentaire,Non spécifié,Bac+2,2 ans,Non spécifié,Non spécifié,Innovation,https://www.dreamjob.ma/emploi/duroc-recrute-des-electromecaniciens/,2.0
Howmet Aerospace recrute Plusieurs Profils,Howmet Aerospace,Casablanca,Aéronautique,Anapec,Bac+2,Non spécifié,5S,Non spécifié,"Communication, Organisation, Organisation",https://www.dreamjob.ma/emploi/howmet-aerospace-recrute-plusieurs-profils/,
Coca Cola recrute Plusieurs Profils pour 2024,Coca Cola,Non spécifié,"Logistique, Énergie",Non spécifié,Bac+2,5 ans,"5S, Automatisme, GMAO, SAP",Non spécifié,"Adaptabilité, Autonomie, Communication, Flexibilité, Gestion de projet, Leadership, Organisation, Polyvalence, Relationnel, Rigueur, Réactivité, Résolution de problèmes, Travail en équipe",https://www.dreamjob.ma/emploi/coca-cola-recrute-plusieurs-profils-pour-2024/,5.0
Inwi recrute des Responsables Data Centers,Inwi,Casablanca,Énergie,Non spécifié,Bac+5,5 ans,Non spécifié,Non spécifié,Communication,https://www.dreamjob.ma/emploi/inwi-recrute-responsables-data-centers/,5.0
Campagne de Recrutement chez Sunwoda EVB,Non spécifié,Tanger,"Automobile, Logistique, Énergie",Non spécifié,Bac+2,3 ans,"Automatisme, ERP, SAP",Non spécifié,Innovation,https://www.dreamjob.ma/emploi/campagne-recrutement-sunwoda-evb/,3.0
Huawei recrute des Stagiaires Rémunérés sur Casablanca,Huawei,Casablanca,Énergie,Stage,Non spécifié,Non spécifié,Non spécifié,"Français, Anglais","Communication, Résolution de problèmes, Travail en équipe",https://www.dreamjob.ma/stage/huawei-recrute-stagiaires-remuneres/,
LUSEO Group recrute des Techniciens Bâtiments,LUSEO Group,Rabat,Construction,CDI,Non spécifié,Non spécifié,Modélisation,Français,Non spécifié,https://www.dreamjob.ma/emploi/luseo-group-recrute-techniciens-batiments/,
Opportunités de Carrière à la Compagnie Industrielle des Fibres,Non spécifié,Tanger,"Agroalimentaire, Construction",Stage,Bac+2,2 à 5 ans,Excel,Non spécifié,"Autonomie, Communication, Leadership",https://www.dreamjob.ma/emploi/opportunites-de-carriere-a-la-compagnie-industrielle-des-fibres/,3.5
Compagnie Industrielle des Fibres recrute Plusieurs Profils,Compagnie Industrielle des Fibres,Tanger,"Agroalimentaire, Construction, Énergie",Non spécifié,Bac+3,1 an,"Automatisme, Excel",Non spécifié,Leadership,https://www.dreamjob.ma/emploi/compagnie-industrielle-des-fibres-recrute-plusieurs-profils/,1.0
Lesaffre recrute à Casablanca et Fès dès maintenant,Lesaffre,Casablanca,Agroalimentaire,Non spécifié,Bac+2,7 à 10 ans,Non spécifié,"Français, Anglais","Autonomie, Innovation, Leadership, Organisation, Rigueur",https://www.dreamjob.ma/emploi/lesaffre-recrute-a-casablanca-et-fes-des-maintenant/,8.5
Opportunités de Carrière en Allemagne: l’Anapec Recrute (50) Techniciens,Opportunités de Carrière en Allemagne: l’Anapec,Non spécifié,"Automobile, Construction, Métallurgie",CDI,Non spécifié,2 ans,Non spécifié,"Français, Anglais","Autonomie, Autonomie, Communication, Travail en équipe",https://www.dreamjob.ma/emploi/opportunites-de-carriere-en-allemagne-lanapec-recrute-50-techniciens/,2.0
Recrutement de (41) Postes chez Bank Al Maghrib,Non spécifié,Non spécifié,"Chimie, Procédés",Non spécifié,Bac+4,2 ans,Automatisme,Anglais,"Autonomie, Communication, Organisation, Rigueur",https://www.dreamjob.ma/emploi-public/recrutement-de-41-postes-chez-bank-al-maghrib/,2.0
Coca Cola recrute Plusieurs Profils 2023,Coca Cola,Casablanca,"Agroalimentaire, Logistique",Non spécifié,Bac+2,3 ans,"GMAO, SAP","Français, Anglais",Communication,https://www.dreamjob.ma/emploi/coca-cola-recrute-plusieurs-profils-2023/,3.0
Concours Bank Al Maghrib 2022 (18 Postes),Non spécifié,Non spécifié,Logistique,Non spécifié,Bac+5,2 ans,"Automatisme, ERP",Anglais,"Autonomie, Communication, Organisation, Rigueur",https://www.dreamjob.ma/emploi-public/concours-bank-al-maghrib-2022-18-postes/,2.0
Coca Cola recrute chef de projet IT et mécanicien,Coca Cola,Casablanca,Non spécifié,Non spécifié,Bac+2,5 ans,"GMAO, SAP",Anglais,"Adaptabilité, Communication, Gestion de projet, Organisation, Travail en équipe",https://www.dreamjob.ma/emploi/coca-cola-recrute-chef-de-projet-it-et-mecanicien/,5.0
3 postes ouverts chez Faurecia à Rabat,Non spécifié,Rabat,"Automobile, Logistique",Non spécifié,Non spécifié,2 à 5 ans,"5S, APQP, Lean, Lean manufacturing, SAP",Anglais,"Autonomie, Gestion de projet, Leadership, Organisation, Réactivité, Résolution de problèmes",https://www.dreamjob.ma/emploi/3-postes-ouverts-chez-faurecia-a-rabat/,3.5
TotalEnergies ouvre plusieurs postes techniques au Maroc,TotalEnergies,Non spécifié,"Aéronautique, Chimie, Énergie",CDI,Bac+2,5 ans,"Automatisme, Excel",Français,"Communication, Force de proposition, Initiative, Innovation, Polyvalence, Réactivité, Travail en équipe",https://www.dreamjob.ma/emploi/totalenergies-ouvre-plusieurs-postes-techniques-au-maroc/,5.0
Gestamp ouvre 5 postes à Kénitra,Gestamp,Kénitra,Automobile,Stage,Non spécifié,Non spécifié,SAP,Anglais,"Communication, Innovation, Organisation, Organisation, Rigueur",https://www.dreamjob.ma/emploi/gestamp-ouvre-5-postes-a-kenitra/,
8 nouvelles opportunités ouvertes avec l’ANAPEC,Non spécifié,Youssoufia,"Construction, Construction, Logistique, Procédés",CDI,Bac+2,3 ans,Autocad,"Français, Anglais","Communication, Leadership, Organisation, Rigueur, Résolution de problèmes",https://www.dreamjob.ma/emploi/7-nouvelles-opportunites-ouvertes-avec-lanapec/,3.0
Bel propose de nouveaux postes à Casablanca et Tanger,Non spécifié,Casablanca,Agroalimentaire,Non spécifié,Bac+5,4 à 5 ans,"5S, Automatisme, Robotique, SAP",Non spécifié,"Autonomie, Communication, Innovation, Leadership, Relationnel, Rigueur",https://www.dreamjob.ma/emploi/bel-propose-de-nouveaux-postes-a-casablanca-et-tanger/,4.5
Gestamp ouvre 7 opportunités dans l’automobile,Gestamp,Kénitra,Automobile,CDI,Non spécifié,Non spécifié,SAP,Anglais,"Communication, Force de proposition, Innovation, Leadership, Organisation, Organisation, Rigueur, Réactivité",https://www.dreamjob.ma/emploi/gestamp-ouvre-7-opportunites-dans-lautomobile/,
Nouvelles opportunités chez Bel dès maintenant,Non spécifié,Casablanca,Agroalimentaire,Non spécifié,Bac+5,5 ans,"Automatisme, Robotique",Non spécifié,"Autonomie, Innovation, Rigueur",https://www.dreamjob.ma/emploi/nouvelles-opportunites-chez-bel-des-maintenant/,5.0
5 Opportunités aéronautiques disponibles chez Atlas Defense à Benslimane,Non spécifié,Non spécifié,Aéronautique,CDI,Bac+2,2 à 5 ans,ERP,"Français, Anglais, Arabe","Autonomie, Rigueur, Travail en équipe",https://www.dreamjob.ma/emploi/5-opportunites-aeronautiques-disponibles-chez-atlas-defense-a-benslimane/,3.5
TE Connectivity recherche 5 nouveaux profils à tanger,Non spécifié,Tanger,"Automobile, Logistique, Plasturgie, Énergie",CDI,Bac+2,2 ans,"5S, ERP, SAP",Non spécifié,Non spécifié,https://www.dreamjob.ma/emploi/te-connectivity-recherche-5-nouveaux-profils-a-tanger/,2.0
Opportunités d’emploi industriel chez SOMADIR à Casablanca,Non spécifié,Casablanca,Agroalimentaire,CDI,Bac+2,3 ans,Non spécifié,Non spécifié,"Autonomie, Communication, Organisation, Rigueur",https://www.dreamjob.ma/emploi/opportunites-demploi-industriel-chez-somadir-a-casablanca/,3.0
Opportunités chez Emirates Logistics Morocco à Tanger MED,Non spécifié,Tanger,Logistique,CDI,Bac+2,3 ans,GMAO,"Français, Anglais, Arabe","Autonomie, Organisation, Relationnel, Rigueur, Travail en équipe",https://www.dreamjob.ma/emploi/opportunites-chez-emirates-logistics-morocco-a-tanger-med/,3.0
Fondation Zakoura recrute plusieurs profils à Casablanca et Settat,Fondation Zakoura,Casablanca,Non spécifié,CDI,Bac+3,2 ans,Non spécifié,"Français, Arabe","Organisation, Proactivité, Rigueur, Travail en équipe",https://www.dreamjob.ma/emploi/fondation-zakoura-recrute-plusieurs-profils-a-casablanca-et-settat/,2.0
5 Offres d’emploi chez Samsic Casablanca et Rabat à saisir,Non spécifié,Casablanca,Non spécifié,CDI,Bac+2,2 ans,GMAO,"Français, Anglais","Autonomie, Communication, Innovation, Relationnel, Rigueur, Réactivité",https://www.dreamjob.ma/emploi/5-offres-demploi-chez-samsic-casablanca-et-rabat-a-saisir/,2.0
MADREX Engineering ouvre des stages PFE à Mohammedia,MADREX Engineering,Mohammedia,Non spécifié,Stage,Bac+5,Non spécifié,"CAO, Modélisation",Non spécifié,"Autonomie, Innovation, Rigueur",https://www.dreamjob.ma/stage/madrex-engineering-ouvre-des-stages-pfe-a-mohammedia/,
Bontaz recrute 14 stagiaires PFE à El Jadida,Bontaz,El jadida,"Automobile, Logistique",Stage,Bac+5,Non spécifié,Non spécifié,"Français, Anglais","Innovation, Rigueur",https://www.dreamjob.ma/stage/bontaz-recrute-14-stagiaires-pfe-a-el-jadida/,
International Paper recrute à Tanger et Casablanca,International Paper,Casablanca,Non spécifié,Non spécifié,Bac+2,2 ans,"ERP, Excel, Modélisation, Python, SAP, SQL","Français, Anglais","Communication, Rigueur",https://www.dreamjob.ma/emploi/international-paper-recrute-a-tanger-et-casablanca/,2.0
Rotomoulage du Sud recrute à Casablanca des dessinateurs,Rotomoulage du Sud,Casablanca,Procédés,CDI,Bac+2,Non spécifié,"CATIA, Conception mécanique, NX",Non spécifié,Rigueur,https://www.dreamjob.ma/emploi/rotomoulage-du-sud-recrute-a-casablanca-des-dessinateurs/,
Airbus Atlantic Maroc recrute des Ajusteurs-Monteurs à Nouaceur,Airbus Atlantic Maroc,Casablanca,"Aéronautique, Construction, Procédés",Anapec,Bac+2,Non spécifié,Non spécifié,Non spécifié,"Créativité, Innovation, Rigueur, Travail en équipe",https://www.dreamjob.ma/emploi/airbus-atlantic-maroc-recrute-des-ajusteurs-monteurs-a-nouaceur/,
Leader Food recrute à Casablanca des techniciens expérimentés,Leader Food,Casablanca,Agroalimentaire,Non spécifié,Bac+2,2 ans,Automatisme,Non spécifié,"Innovation, Rigueur, Réactivité",https://www.dreamjob.ma/emploi/leader-food-recrute-a-casablanca-des-techniciens-experimentes/,2.0
Offres d’emploi SICDA Berrechid – Postulez dès maintenant !,Non spécifié,Berrechid,Chimie,Non spécifié,Bac+2,2 à 4 ans,GMAO,Non spécifié,Innovation,https://www.dreamjob.ma/emploi/offres-demploi-sicda-berrechid-postulez-des-maintenant/,3.0
Peugeot Citroën Maroc recrute à Kénitra – 140 Postes d’opérateurs à saisir,Peugeot Citroën Maroc,Kénitra,Automobile,Anapec,Bac+2,Non spécifié,Non spécifié,Non spécifié,Innovation,https://www.dreamjob.ma/emploi/peugeot-citroen-maroc-recrute-a-kenitra-140-postes-doperateurs-a-saisir/,
Airbus Atlantic ouvre des postes dans l’aéronautique,Airbus Atlantic,Casablanca,"Aéronautique, Construction, Procédés",Stage,Bac+2,Non spécifié,Non spécifié,Non spécifié,"Innovation, Rigueur",https://www.dreamjob.ma/emploi/airbus-atlantic-ouvre-des-postes-dans-laeronautique/,
SEBN recrute – nouvelles opportunités dans l’automobile à Bouknadel,SEBN,Non spécifié,"Automobile, Procédés",CDI,Bac+5,5 ans,ERP,"Français, Anglais","Communication, Innovation, Leadership, Rigueur",https://www.dreamjob.ma/emploi/sebn-recrute-nouvelles-opportunites-dans-lautomobile-a-bouknadel/,5.0
